<Script xmlns:xsi="http://www.w3.org/2001/XMLSchema-instance" xsi:noNamespaceSchemaLocation='Scriptor.xsd'>
	<Name>Split_Crc_PostImport</Name>
	<Decription>desc</Decription>
	<Expression>as:modconf('Crc')[1]</Expression>
	<Operations>
		<!-- Enable Crc calculation -->
		<Operation Type= "ForEach">
			<Expression>as:modconf('Crc')[1]/CrcGeneral/Crc16Mode</Expression>
			<Operations>
				<Operation Type="SetEnabled">
					<Expression>boolean(1)</Expression>
				</Operation>
			</Operations>
		</Operation>
		<Operation Type= "ForEach">
			<Expression>as:modconf('Crc')[1]/CrcGeneral/Crc32Mode</Expression>
			<Operations>
				<Operation Type="SetEnabled">
					<Expression>boolean(1)</Expression>
				</Operation>
			</Operations>
		</Operation>
		
	</Operations>
    
</Script>